{
  "schemaVersion": 1,
  "name": "Valid Show With Null Bound",
  "tagline": "A green-variant tagline, comfortably within the SPEC F115.1 1x budget.",
  "flavor": "Green-variant flavor text for tools/run_selftest.sh — a schema-valid show manifest carrying SPEC F152.3's own documented payload shape (maxPlays set, notAiredWithinDays explicit JSON null), copied into a temporary entries/ tree at test time to exercise kind-aware validation and index building end to end.",
  "envelope": { "rotation": { "maxPlays": 0, "notAiredWithinDays": null } }
}
